title,company,location,description,created,category,clean_description
DevOps Engineer,Cross Border Talents,"Veldhoven, Noord-Brabant","Currently, Cross Border Talents are in search of a DevOps Engineer for one of our clients in the Netherlands. The company in question is a renowned Dutch agency specialized in the recruitment and relocation of technical specialists for the Netherlands. Some of the names they work with include clients like ASML, VDL, DAF Trucks, Siemens and many more. For one of their projects for a company which is an international innovation leader in the semiconductor industry, they are looking for a DevOps E…",2023-04-09T18:13:14Z,DevOps,currently cross border talents are in search of a devops engineer for one of our clients in the netherlands the company in question is a renowned dutch agency specialized in the recruitment and relocation of technical specialists for the netherlands some of the names they work with include clients like asml vdl daf trucks siemens and many more for one of their projects for a company which is an international innovation leader in the semiconductor industry they are looking for a devops
Software Development Tools Specialist (DevOps),ASML,"Veldhoven, Noord-Brabant","We are looking for a medior/senior Software Development Tools Specialist, a person who can take up hands-on technical lead for different tools facilitating. Introduction We are looking for a medior/senior Software Development Tools Specialist, a person who can take up hands-on technical lead for different tools facilitating for the so-called EUV Source software development environment. Job Mission Maintain and modify the implementation of tools and way of working for the EUV Source environment,…",2023-12-18T12:35:50Z,DevOps,we are looking for a mediorsenior software development tools specialist a person who can take up handson technical lead for different tools facilitating introduction we are looking for a mediorsenior software development tools specialist a person who can take up handson technical lead for different tools facilitating for the socalled euv source software development environment job mission maintain and modify the implementation of tools and way of working for the euv source
Full Stack Engineer,Square One Resources,"Veldhoven, Noord-Brabant","Are you passionate about solving complex problems with clean, scalable code? Do you thrive in a dynamic, project-based environment where learning never stops? We’re looking for an experienced Full stack Developer to join our clients growing team of dedicated professionals hybrid in The Randstad. At their core, they develop full-stack Java-based solutions for a wide range of clients—from startups to established enterprises. Their projects are driven by data, powered by predictive algorithms, and…",2025-08-01T03:02:08Z,DevOps,are you passionate about solving complex problems with clean scalable code do you thrive in a dynamic projectbased environment where learning never stops looking for an experienced full stack developer to join our clients growing team of dedicated professionals hybrid in the randstad at their core they develop fullstack javabased solutions for a wide range of startups to established enterprises their projects are driven by data powered by predictive algorithms
Generative AI Architect - Freelance,Cognitive Group | Part of the Focus Cloud Group,"Veldhoven, Noord-Brabant","GenAI Architect Role Overview: This role focuses on designing and implementing the end-to-end GenAI architecture, from LLM integration to deployment and scaling. The architect will not manage products but instead focus on technical leadership, especially in integrating GenAI systems into hyperscaler environments with enterprise-grade scalability and performance. Key Responsibilities: Lead the technical design and system architecture for GenAI solutions, including: LLM hosting/inference strategi…",2025-08-01T02:59:58Z,DevOps,genai architect role overview this role focuses on designing and implementing the endtoend genai architecture from llm integration to deployment and scaling the architect will not manage products but instead focus on technical leadership especially in integrating genai systems into hyperscaler environments with enterprisegrade scalability and performance key responsibilities lead the technical design and system architecture for genai solutions including llm hostinginference
Remote Business Central Developer,LikeMind Recruitment,"Veldhoven, Noord-Brabant","Business Central Developer (m/f/d) – Hybrid, Netherlands Exciting news Our client is hiring! They’re a well-established IT solutions provider specialising in Microsoft Dynamics 365 Business Central and related Microsoft technologies, including Power Platform, Azure, and Office 365. They deliver development, project implementation, and customised ERP solutions for mid-sized businesses and enterprises across the Benelux. With a focus on growth and innovation, they’re now looking to bring a full-t…",2025-08-01T03:00:40Z,DevOps,business central developer mfd hybrid netherlands exciting news our client is hiring a wellestablished it solutions provider specialising in microsoft dynamics business central and related microsoft technologies including power platform azure and office they deliver development project implementation and customised erp solutions for midsized businesses and enterprises across the benelux with a focus on growth and innovation now looking to bring a
Data Scientist,eTeam,"Veldhoven, Noord-Brabant","Role: Data Scientists Salary : 103k per annum  holidays Contract Position Duration : 11-Aug-2025 - 28-Feb-2026 Remote in the Netherlands with a Valid work visa Description: You will work in Data & Analytics together with other Data Scientists, Data Engineers, Data Analysts, Machine Learning Engineers, Data Stewards and Data Architects. Together you will be joining cross-functional teams consisting of colleagues from Technology, Product and Design from the business domain of Business Support. We…",2025-07-31T22:44:49Z,DevOps,role data scientists salary per annum holidays contract position duration remote in the netherlands with a valid work visa description you will work in data analytics together with other data scientists data engineers data analysts machine learning engineers data stewards and data architects together you will be joining crossfunctional teams consisting of colleagues from technology product and design from the business domain of business support
C#.NET Developer,Ndus3,"Veldhoven, Noord-Brabant","Je wil je ontwikkelen, net als wij. Groeien en zoveel mogelijk ervaring opdoen, zodat je de beste punten eruit mee kunt nemen en kunt gebruiken om je ambities waar te maken. Dat vinden wij leuk man! Dus gaan wij jou helpen met onbeperkt leren, ja dat staat er echt. Daarnaast gaan we ervoor zorgen dat je je hier helemaal thuis voelt. Wij zijn op zoek naar een C#.NET Software Developer die enthousiast is en zowel goed in teamverband als zelfstandig kan werken. Je wordt onderdeel van het ontwikkel…",2025-07-23T19:03:16Z,DevOps,je wil je ontwikkelen net als wij groeien en zoveel mogelijk ervaring opdoen zodat je de beste punten eruit mee kunt nemen en kunt gebruiken om je ambities waar te maken dat vinden wij leuk man dus gaan wij jou helpen met onbeperkt leren ja dat staat er echt daarnaast gaan we ervoor zorgen dat je je hier helemaal thuis voelt wij zijn op zoek naar een cnet software developer die enthousiast is en zowel goed in teamverband als zelfstandig kan werken je wordt onderdeel van het
Platform Engineer,Bizzdesign,"Veldhoven, Noord-Brabant","Are you looking for an exciting opportunity within a dynamic international company making an impact globally? We might have the perfect match for you! Who are we? Bizzdesign is a SaaS company with 25 years in the Enterprise Architecture and Strategic Portfolio Management industries, with our HQ in Enschede. Our platform helps large enterprises, including Fortune 500 companies, make better decisions through Enterprise Architecture. We recently acquired Alfabet and MEGA International, expanding o…",2025-07-09T07:11:38Z,DevOps,are you looking for an exciting opportunity within a dynamic international company making an impact globally we might have the perfect match for you who are we bizzdesign is a saas company with years in the enterprise architecture and strategic portfolio management industries with our hq in enschede our platform helps large enterprises including fortune companies make better decisions through enterprise architecture we recently acquired alfabet and mega international expanding
VDI Engineer,ASML,"Veldhoven, Noord-Brabant","Introduction to the job The role will be situated in the Agile Release Train below: Digital Workplace (DW) Digital Workplace provides workplace services for ASML staff world-wide as well as to 3rd party Suppliers. This includes laptops, special purpose devices, mobile device management, worldwide virtual desktops and Collaboration & Productivity services such as Office 365, Webcast, Intranet & Search and various other collaboration tools As VDI Engineer you're co-responsible for the operational…",2025-07-31T09:10:59Z,DevOps,introduction to the job the role will be situated in the agile release train below digital workplace dw digital workplace provides workplace services for asml staff worldwide as well as to party suppliers this includes laptops special purpose devices mobile device management worldwide virtual desktops and collaboration productivity services such as office webcast intranet search and various other collaboration tools as vdi engineer youre coresponsible for the
Senior Java Developer,Cross Border Talents,"Veldhoven, Noord-Brabant","Currently, Cross Border Talents are in search of a Senior Java Developer for one of our clients in the Netherlands. The company in question is a renowned Dutch agency specialized in the recruitment and relocation of technical specialists for the Netherlands. Some of the names they work with include clients like ASML, VDL, DAF Trucks, Siemens and many more. For one of their projects for an international innovation leader in the semiconductor industry, they are looking for a Java Developer. You’l…",2023-05-02T16:48:45Z,DevOps,currently cross border talents are in search of a senior java developer for one of our clients in the netherlands the company in question is a renowned dutch agency specialized in the recruitment and relocation of technical specialists for the netherlands some of the names they work with include clients like asml vdl daf trucks siemens and many more for one of their projects for an international innovation leader in the semiconductor industry they are looking for a java developer
Security Engineer Firewall,Simac,"Veldhoven, Noord-Brabant","Wat jij gaat doen Neem jij jouw diploma binnenkort in handen of heb je nu net een tussenjaar gehad? Dan hebben we een leuke plek voor jou bij onze security afdeling! Als kloppend hart van een organisatie is de beveiliging middels firewalling een key positie! Grote namen zoals Jumbo, Primera, PSV, een tal van zorgklanten en nog veel meer vallen onder jouw hoede, samen met je collega’s. Als Security Engineer bij Simac zorg jij voor de veiligheid van onze IT-dienstverlening. Je werkt nauw samen me…",2025-04-06T05:51:58Z,DevOps,wat jij gaat doen neem jij jouw diploma binnenkort in handen of heb je nu net een tussenjaar gehad dan hebben we een leuke plek voor jou bij onze security afdeling als kloppend hart van een organisatie is de beveiliging middels firewalling een key positie grote namen zoals jumbo primera psv een tal van zorgklanten en nog veel meer vallen onder jouw hoede samen met je als security engineer bij simac zorg jij voor de veiligheid van onze itdienstverlening je werkt nauw samen
Software Engineer (Remote) - Java/Angular,Doghouse Recruitment,"Veldhoven, Noord-Brabant","Full-Stack Engineer · Java/Spring Boot & Angular · Remote Europe · Up To €65K  Benefits Are you a hands-on engineer who enjoys building useful products and solving real problems for modern, distributed teams? Want to work in a fast-moving SaaS environment that values flexibility, ownership, and async communication? Join a fully remote company that’s redefining how global teams handle business travel and employee mobility. With products already live in Vacations, Business Travel, and Visas, they…",2025-08-01T02:59:35Z,DevOps,fullstack engineer javaspring boot angular remote europe up to benefits are you a handson engineer who enjoys building useful products and solving real problems for modern distributed teams want to work in a fastmoving saas environment that values flexibility ownership and async communication join a fully remote company redefining how global teams handle business travel and employee mobility with products already live in vacations business travel and visas
IGA Developer,Axiom Software Solutions Limited,"Veldhoven, Noord-Brabant",Job Mission As IGA Developer with strong consultancy skills and competences you are part of an Agile team responsible for the development and configuration of our IAM IGA tools. You are owning the technical design of IGA in the IAM landscape and as such you are taking the technical lead in the development of IGA in ASML while supporting the onboarding of applications and other changes and automation based on standardization. All of this includes guidance to an offshore team. The IGA Developer w…,2025-04-07T19:52:35Z,DevOps,job mission as iga developer with strong consultancy skills and competences you are part of an agile team responsible for the development and configuration of our iam iga tools you are owning the technical design of iga in the iam landscape and as such you are taking the technical lead in the development of iga in asml while supporting the onboarding of applications and other changes and automation based on standardization all of this includes guidance to an offshore team the iga developer
Cryptography Developer,Axiom Software Solutions Limited,"Veldhoven, Noord-Brabant","As a Crypto Engineer with strong consultancy skills and competences, you are part of a Scrum Team (SAFe) managing and operating our IAM Crypto landscape. The Crypto environment is newly setup within the IAM. Originally it was “only“ PKI, Key-Management is now added and we are working on implementing a new CLM. The team is owning the technical design, development and operation of cryptography and everything related to certificates. Automation is a key strategy of ASML IT, enhanced by self-servic…",2025-04-08T10:50:09Z,DevOps,as a crypto engineer with strong consultancy skills and competences you are part of a scrum team safe managing and operating our iam crypto landscape the crypto environment is newly setup within the iam originally it was pki keymanagement is now added and we are working on implementing a new clm the team is owning the technical design development and operation of cryptography and everything related to certificates automation is a key strategy of asml it enhanced by
Product Manager,GS1,"Veldhoven, Noord-Brabant","GS1 offers a portfolio of services and tools to make the adoption of our standards for industry easier and more impactful. The Product Manager GS1 Data Services will be responsible for delivering GS1 Data Services towards the product vision of the GS1 Federation. The position will have a global responsibility for all product-related aspects. As the Product Manager, you combine strategic thinking with a strong focus on execution for delivering outstanding product experiences that achieve organis…",2025-08-01T03:01:49Z,DevOps,offers a portfolio of services and tools to make the adoption of our standards for industry easier and more impactful the product manager data services will be responsible for delivering data services towards the product vision of the federation the position will have a global responsibility for all productrelated aspects as the product manager you combine strategic thinking with a strong focus on execution for delivering outstanding product experiences that achieve
Teamcenter Security Architect/Technical Lead,ASML,"Veldhoven, Noord-Brabant","Introduction to the job Our PLM and Configuration Management department is responsible for delivering solutions that push the limits of technology to unlock the business value of digital design and Product Lifecycle Management (PLM). We deliver cutting-edge PLM solutions to solve some of ASML’s toughest challenges. Together with our partners, and based on global best practices, we deliver the digital foundation of product innovation. In this role you'll be the bridge between the PLM functional …",2025-07-01T13:09:20Z,DevOps,introduction to the job our plm and configuration management department is responsible for delivering solutions that push the limits of technology to unlock the business value of digital design and product lifecycle management plm we deliver cuttingedge plm solutions to solve some of toughest challenges together with our partners and based on global best practices we deliver the digital foundation of product innovation in this role youll be the bridge between the plm functional
Solution Architect - Microsoft D365 F&O (Remote),HEF associates,"Veldhoven, Noord-Brabant","For a trusted client, we are looking for a Solution Architect to join a young growing scaleup who is active in a niche market for which they developed a market specific solution. The solution is the best solution available within this specific market and because they are getting more traction, they are needing to grow the team. Our client is growing throughout the whole of Europe, and has a remote team working from a variety of countries which means this job is remote with travel to clients thr…",2025-07-17T08:08:28Z,DevOps,for a trusted client we are looking for a solution architect to join a young growing scaleup who is active in a niche market for which they developed a market specific solution the solution is the best solution available within this specific market and because they are getting more traction they are needing to grow the team our client is growing throughout the whole of europe and has a remote team working from a variety of countries which means this job is remote with travel to clients
Cloud Infrastructure Engineer,BDO,"Veldhoven, Noord-Brabant","About BDO BDO is the leading mid-tier professional services provider globally. In 2024, our core service lines (Audit & Assurance, Tax, Advisory, and Business Services & Outsourcing) generated annual revenues of over US$15 billion. With a worldwide community of over 119k professionals operating in 166 countries and territories, we’re dedicated to helping our clients navigate complex financial and strategic challenges, aligned to our core purpose ‘ People helping people. ’ Why join us? A great p…",2025-06-12T22:07:03Z,DevOps,about bdo bdo is the leading midtier professional services provider globally in our core service lines audit assurance tax advisory and business services outsourcing generated annual revenues of over billion with a worldwide community of over professionals operating in countries and territories dedicated to helping our clients navigate complex financial and strategic challenges aligned to our core purpose people helping people why join us a great
Data Scientist,eTeam,"Veldhoven, Noord-Brabant","Role: Data Scientists Salary : 103k per annum  holidays Contract Position Duration : 11-Aug-2025 - 28-Feb-2026 Remote in the Netherlands with a Valid work visa Description: You will work in Data & Analytics together with other Data Scientists, Data Engineers, Data Analysts, Machine Learning Engineers, Data Stewards and Data Architects. Together you will be joining cross-functional teams consisting of colleagues from Technology, Product and Design from the business domain of Business Support. We…",2025-07-31T22:44:49Z,Data Analyst,role data scientists salary per annum holidays contract position duration remote in the netherlands with a valid work visa description you will work in data analytics together with other data scientists data engineers data analysts machine learning engineers data stewards and data architects together you will be joining crossfunctional teams consisting of colleagues from technology product and design from the business domain of business support
Data Architectuur Specialist (Data Modelleur / Data Architect),CIMSOLUTIONS,"Veldhoven, Noord-Brabant","Als Data Architectuur Specialist ben je verantwoordelijk voor het ontwerpen, ontwikkelen, beheren en implementeren van datamodellen en de data-architectuur bij of voor onze gerenommeerde klanten waaronder Belastingdienst, Gemeente Den Haag, diverse ministeries, Centraal Justitieel Incassobureau of VGZ. Afhankelijk van het ervaringsniveau ligt de focus op verschillende aspecten van datamodellering en data-architectuur. Waarom past deze vacature bij jou? Als Data Architectuur Specialist speel jij…",2025-07-09T07:11:50Z,Data Analyst,als data architectuur specialist ben je verantwoordelijk voor het ontwerpen ontwikkelen beheren en implementeren van datamodellen en de dataarchitectuur bij of voor onze gerenommeerde klanten waaronder belastingdienst gemeente den haag diverse ministeries centraal justitieel incassobureau of vgz afhankelijk van het ervaringsniveau ligt de focus op verschillende aspecten van datamodellering en dataarchitectuur waarom past deze vacature bij jou als data architectuur specialist speel
Data and Use-Case Analyst – SupTech Solutions,NTU International A/S,"Veldhoven, Noord-Brabant","Data and Use-Case Analyst – SupTech Solutions Location: Europe Duration: Short- to medium-term Estimated Workload: Short-term assignments / task-based consultancy About the Opportunity: We are creating a pool of Data and Use-Case Analysts – SupTech Solutions for a new FWC Contract: EC-SG REFORM/2025/OP/0001: Provision of consultancy services to support the design, development, implementation, monitoring and evaluation of structural reforms in EU Member State. Experts in this pool will be contac…",2025-07-09T01:10:24Z,Data Analyst,data and usecase analyst suptech solutions location europe duration short to mediumterm estimated workload shortterm assignments taskbased consultancy about the opportunity we are creating a pool of data and usecase analysts suptech solutions for a new fwc contract ecsg provision of consultancy services to support the design development implementation monitoring and evaluation of structural reforms in eu member state experts in this pool will be
Lead C++ Software Engineer (Gameplay),Playrix,"Veldhoven, Noord-Brabant","Playrix — одна из самых успешных компаний по разработке мобильных игр в мире. По доходам среди всех мобильных приложений мы входим в топ-3 в мире, а в Европе мы первые. Наши игры установили 2,3 миллиарда раз (треть населения Земли), каждый день в них играет более 30 миллионов людей по всему миру! У нас большие планы на развитие и рост наших проектов, именно поэтому мы ищем сильнейших экспертов в наши команды разработки. При этом опыт работы на С и/или в геймдеве совсем необязателен: у нас отлич…",2025-04-24T23:33:49Z,Software Engineer,playrix одна из самых успешных компаний по разработке мобильных игр в мире по доходам среди всех мобильных приложений мы входим в в мире а в европе мы первые наши игры установили миллиарда раз треть населения земли каждый день в них играет более миллионов людей по всему миру у нас большие планы на развитие и рост наших проектов именно поэтому мы ищем сильнейших экспертов в наши команды разработки при этом опыт работы на с иили в геймдеве совсем необязателен у нас
Software Engineer (Remote) - Java/Angular,Doghouse Recruitment,"Veldhoven, Noord-Brabant","Full-Stack Engineer · Java/Spring Boot & Angular · Remote Europe · Up To €65K  Benefits Are you a hands-on engineer who enjoys building useful products and solving real problems for modern, distributed teams? Want to work in a fast-moving SaaS environment that values flexibility, ownership, and async communication? Join a fully remote company that’s redefining how global teams handle business travel and employee mobility. With products already live in Vacations, Business Travel, and Visas, they…",2025-08-01T02:59:35Z,Software Engineer,fullstack engineer javaspring boot angular remote europe up to benefits are you a handson engineer who enjoys building useful products and solving real problems for modern distributed teams want to work in a fastmoving saas environment that values flexibility ownership and async communication join a fully remote company redefining how global teams handle business travel and employee mobility with products already live in vacations business travel and visas
