title,company,location,description,created,category,clean_description
Senior C++ Software Engineer (Gameplay),Playrix,"Veldhoven, Noord-Brabant","Playrix — одна из самых успешных компаний по разработке мобильных игр в мире. По доходам среди всех мобильных приложений мы входим в топ-3 в мире, а в Европе мы первые. Наши игры установили 2,3 миллиарда раз (треть населения Земли), каждый день в них играет более 30 миллионов людей по всему миру! У нас большие планы на развитие и рост наших проектов, именно поэтому мы ищем сильнейших экспертов в наши команды разработки. При этом опыт работы на С и/или в геймдеве совсем необязателен: у нас отлич…",2025-04-24T23:33:47Z,Software Engineer,playrix одна из самых успешных компаний по разработке мобильных игр в мире по доходам среди всех мобильных приложений мы входим в в мире а в европе мы первые наши игры установили миллиарда раз треть населения земли каждый день в них играет более миллионов людей по всему миру у нас большие планы на развитие и рост наших проектов именно поэтому мы ищем сильнейших экспертов в наши команды разработки при этом опыт работы на с иили в геймдеве совсем необязателен у нас
Junior Projectleider,Regel Partners B.V. - System Integrators met inhoud,"Veldhoven, Noord-Brabant","Gebouwen worden steeds slimmer en dat maakt de wereld van Regel Partners enorm uitdagend! Onze organisatie automatiseert en visualiseert alle denkbare installaties in en rondom gebouwen. Wij houden van toonaangevende, aansprekende en duurzame projecten. Jij ook? Als Junior Projectleider ben je verantwoordelijk voor het verrichten van de werkvoorbereiding en (software) engineering van projecten en het daarbij realiseren en calculeren van meer- en minderwerk. Je bent een belangrijke schakel in he…",2025-07-09T07:12:11Z,Software Engineer,gebouwen worden steeds slimmer en dat maakt de wereld van regel partners enorm uitdagend onze organisatie automatiseert en visualiseert alle denkbare installaties in en rondom gebouwen wij houden van toonaangevende aansprekende en duurzame projecten jij ook als junior projectleider ben je verantwoordelijk voor het verrichten van de werkvoorbereiding en software engineering van projecten en het daarbij realiseren en calculeren van meer en minderwerk je bent een belangrijke schakel in
Senior Software Design Engineer,ASML,"Veldhoven, Noord-Brabant","ASML is leading in the worldwide development, production, sales of high end lithography systems for the semiconductor industry. Worldwide over 20.000 people work at AS ASML is leading in the worldwide development, production and sales of high end lithography systems for the semiconductor industry. Worldwide over 20.000 people work at ASML, with important settlings in the United States, Asia and the head office in Veldhoven. The employees of ASML share the passion for technology with a customer …",2023-12-18T12:35:50Z,Software Engineer,asml is leading in the worldwide development production sales of high end lithography systems for the semiconductor industry worldwide over people work at as asml is leading in the worldwide development production and sales of high end lithography systems for the semiconductor industry worldwide over people work at asml with important settlings in the united states asia and the head office in veldhoven the employees of asml share the passion for technology with a customer
Master/PhD in Computer Science,Innodata Inc.,"Veldhoven, Noord-Brabant","Job Title: AI Trainer (LLM Training – Computer Science Domain) Location: Remote About the Role: We are seeking highly qualified individuals with a Master’s or PhD in Computer Science to join our AI development team as AI Trainers . In this role, you will use your deep technical knowledge to evaluate, annotate, and provide structured feedback on AI-generated content produced by Large Language Models (LLMs). Your expertise will bring a level of precision, technical depth, and computational reason…",2025-07-23T19:03:04Z,Software Engineer,job title ai trainer llm training computer science domain location remote about the role we are seeking highly qualified individuals with a or phd in computer science to join our ai development team as ai trainers in this role you will use your deep technical knowledge to evaluate annotate and provide structured feedback on aigenerated content produced by large language models llms your expertise will bring a level of precision technical depth and computational
Software Design Engineer for Metrology,ASML,"Veldhoven, Noord-Brabant",Are you an expert in requirements engineering and challenged by translating functional requirements into lean software designs?Do you combine strong analytical reasoning and concep Introduction Are you an expert in requirements engineering and challenged by translating functional requirements into lean software designs?Do you combine strong analytical reasoning and conceptual understanding with excellent communication skills? Job Mission Metrology software orchestrates the behavior of powerful …,2023-12-18T12:35:48Z,Software Engineer,are you an expert in requirements engineering and challenged by translating functional requirements into lean software designsdo you combine strong analytical reasoning and concep introduction are you an expert in requirements engineering and challenged by translating functional requirements into lean software designsdo you combine strong analytical reasoning and conceptual understanding with excellent communication skills job mission metrology software orchestrates the behavior of powerful
Recruitment Consultant,Orange Quarter,"Veldhoven, Noord-Brabant","Orange Quarter is looking for a Recruitment Consultant to join a high performing team recruitment team in Amsterdam. We work with some of Amsterdam's best-known startups and scale ups to help them hire across AI, Data, Software Engineering and Product. As a Recruitment Consultant, you might not have previous recruitment experience however, the ideal candidate will at least have a strong understanding of sales and relationship building. You will need to be confident in building relationships, wh…",2025-08-01T03:01:23Z,Software Engineer,orange quarter is looking for a recruitment consultant to join a high performing team recruitment team in amsterdam we work with some of amsterdams bestknown startups and scale ups to help them hire across ai data software engineering and product as a recruitment consultant you might not have previous recruitment experience however the ideal candidate will at least have a strong understanding of sales and relationship building you will need to be confident in building relationships
Scrum Master - Embedded Software Design Engineering,ASML,"Veldhoven, Noord-Brabant",Would you like to be the leader of a team of 10 to 12 people whose mission is to develop software for one of our products in an AGILE/SAFe environment? Are you the self-starter who Introduction Would you like to be the leader of a team of 10 to 12 people whose mission is to develop software for one of our products in an AGILE/SAFe environment? Are you the self-starter who can deliver successfully although you do not have all the requirements at the start? Do you like to cooperate with physicist…,2024-02-13T13:02:07Z,Software Engineer,would you like to be the leader of a team of to people whose mission is to develop software for one of our products in an agilesafe environment are you the selfstarter who introduction would you like to be the leader of a team of to people whose mission is to develop software for one of our products in an agilesafe environment are you the selfstarter who can deliver successfully although you do not have all the requirements at the start do you like to cooperate with
Javascript Developer,La Fosse,"Veldhoven, Noord-Brabant","Senior JavaScript / Node.js Engineer Location: Hybrid/Remote options (Netherlands) Salary: €5,800 – €7,200 per month (based on 40h/week) A fast-moving product company based in the Netherlands is looking for a Senior JavaScript / Node.js Engineer to join their growing tech team. You’ll work on high-impact digital platforms used across Europe, with a strong focus on performance, scalability, and clean architecture. You’ll play a key role in building back-end services using Node.js and TypeScript,…",2025-07-09T07:11:50Z,Software Engineer,senior javascript nodejs engineer location hybridremote options netherlands salary per month based on a fastmoving product company based in the netherlands is looking for a senior javascript nodejs engineer to join their growing tech team work on highimpact digital platforms used across europe with a strong focus on performance scalability and clean architecture play a key role in building backend services using nodejs and
.NET Fullstack Developer,OBSS,"Veldhoven, Noord-Brabant","We are looking for a skilled .NET Fullstack Developer with a strong background in projects to contribute to the design, development, and maintenance of our payment service software applications. You will work closely with cross-functional teams to deliver high-quality solutions that meet the unique needs of our payment systems client. QUALIFICATIONS Bachelor's degree in Computer Science, Software Engineering, or a related field, Senior Full Stack: NET core 3.1 or .NET 6 (8yrs exp), React( 6yrs …",2025-07-31T22:44:51Z,Software Engineer,we are looking for a skilled net fullstack developer with a strong background in projects to contribute to the design development and maintenance of our payment service software applications you will work closely with crossfunctional teams to deliver highquality solutions that meet the unique needs of our payment systems client qualifications bachelors degree in computer science software engineering or a related field senior full stack net core or net exp react
Yieldstar Product Architect,ASML,"Veldhoven, Noord-Brabant",Do you like working on cutting edge metrology systems? Working on the forefront on what is possible and realizing Moore's law? Then check this out Job Mission Translate the product requirements for the YieldStar system and its applications into software specific requirements and update the software architecture. Job Description You will build a thorough knowledge of the YieldStar products developed in the Applications Business Line; and participate in the definition of these products. You will …,2024-02-13T13:02:07Z,Software Engineer,do you like working on cutting edge metrology systems working on the forefront on what is possible and realizing moores law then check this out job mission translate the product requirements for the yieldstar system and its applications into software specific requirements and update the software architecture job description you will build a thorough knowledge of the yieldstar products developed in the applications business line and participate in the definition of these products you will
Graduation assignment: Data mining to pro-actively detect issues,ASML,"Veldhoven, Noord-Brabant",This is a graduation assignment for a master's student in Software Engineering or a related field. Introduction This is a graduation assignment for a master's student in Software Engineering or a related field. Job Mission Reliability of software is very important for our customers. However we don’t know all issues which occur at customer locations and we only react to issues which are being escalated (re-actively). Job Description Our installed base is very large and contains a lot of informat…,2024-02-13T13:02:08Z,Software Engineer,this is a graduation assignment for a masters student in software engineering or a related field introduction this is a graduation assignment for a masters student in software engineering or a related field job mission reliability of software is very important for our customers however we know all issues which occur at customer locations and we only react to issues which are being escalated reactively job description our installed base is very large and contains a lot of
Graduation assignment: Identify requirements and the optimal solution for simulation batching,ASML,"Veldhoven, Noord-Brabant","Are you a Bachelor student in Computer Science, Software Engineering or Physics and looking for a graduation assignment? Then this internship might be interesting for you. Introduction Are you a Bachelor student in Computer Science, Software Engineering or Physics and looking for a graduation assignment? Then this internship might be interesting for you. Job Mission The Imaging groups in ASML use simulation tools to predict the imaging performance of the ASML products. Due to an increasing numb…",2023-12-18T12:35:46Z,Software Engineer,are you a bachelor student in computer science software engineering or physics and looking for a graduation assignment then this internship might be interesting for you introduction are you a bachelor student in computer science software engineering or physics and looking for a graduation assignment then this internship might be interesting for you job mission the imaging groups in asml use simulation tools to predict the imaging performance of the asml products due to an increasing
Data Scientist,eTeam,"Veldhoven, Noord-Brabant","Role: Data Scientists Salary : 103k per annum  holidays Contract Position Duration : 11-Aug-2025 - 28-Feb-2026 Remote in the Netherlands with a Valid work visa Description: You will work in Data & Analytics together with other Data Scientists, Data Engineers, Data Analysts, Machine Learning Engineers, Data Stewards and Data Architects. Together you will be joining cross-functional teams consisting of colleagues from Technology, Product and Design from the business domain of Business Support. We…",2025-07-31T22:44:49Z,Software Engineer,role data scientists salary per annum holidays contract position duration remote in the netherlands with a valid work visa description you will work in data analytics together with other data scientists data engineers data analysts machine learning engineers data stewards and data architects together you will be joining crossfunctional teams consisting of colleagues from technology product and design from the business domain of business support
Front end Developer,CIMSOLUTIONS,"Veldhoven, Noord-Brabant","Als Front-end Developer ben je verantwoordelijk voor het ontwikkelen en onderhouden van gebruiksvriendelijke en visueel aantrekkelijke interfaces voor webapplicaties. Je werkt nauw samen met UX/UI-designers en back-end developers om designs te vertalen naar functionele en responsieve interfaces. Daarnaast draag je bij aan het verbeteren van de gebruikerservaring en performance van de applicaties. Dit doe je bij of voor onze gerenommeerde klanten waaronder Belastingdienst, Gemeente Den Haag, Cen…",2025-07-09T07:11:39Z,Software Engineer,als frontend developer ben je verantwoordelijk voor het ontwikkelen en onderhouden van gebruiksvriendelijke en visueel aantrekkelijke interfaces voor webapplicaties je werkt nauw samen met uxuidesigners en backend developers om designs te vertalen naar functionele en responsieve interfaces daarnaast draag je bij aan het verbeteren van de gebruikerservaring en performance van de applicaties dit doe je bij of voor onze gerenommeerde klanten waaronder belastingdienst gemeente den haag
Graduation assignment: Boost Usability of myChange Software as UX / UI Designer,ASML,"Veldhoven, Noord-Brabant","Youare a Master or a Bachelor student in a University of Applied Sciences orUniversity in Software Engineering/Computer Science who is looking for a graduation assignment? Introduction You are a Master or a Bachelor student in a University of Applied Sciences or University in Software Engineering/Computer Science who is looking for a graduation assignment. Job Mission ASML’s machineschange 60% for each new version. For all changes costs, benefit, timing, anddependencies are taken into account. …",2023-10-20T13:24:53Z,Software Engineer,youare a master or a bachelor student in a university of applied sciences oruniversity in software engineeringcomputer science who is looking for a graduation assignment introduction you are a master or a bachelor student in a university of applied sciences or university in software engineeringcomputer science who is looking for a graduation assignment job mission machineschange for each new version for all changes costs benefit timing anddependencies are taken into account
IT Software Configuration Management Architect,ASML,"Veldhoven, Noord-Brabant","Founded in 1984, ASML is the world's leading provider of lithography systems for the semiconductor industry, manufacturing complex machines that are critical to the production of i Introduction Founded in 1984, ASML is the world's leading provider of lithography systems for the semiconductor industry, manufacturing complex machines that are critical to the production of integrated circuits or chips. ASML has its R&D and manufacturing operations in Wilton, Connecticut and in Veldhoven, the Nethe…",2023-12-18T12:35:47Z,Software Engineer,founded in asml is the worlds leading provider of lithography systems for the semiconductor industry manufacturing complex machines that are critical to the production of i introduction founded in asml is the worlds leading provider of lithography systems for the semiconductor industry manufacturing complex machines that are critical to the production of integrated circuits or chips asml has its rd and manufacturing operations in wilton connecticut and in veldhoven the
Senior System Industrialization Engineer,Synsel Techniek,"Veldhoven, Noord-Brabant","Hier ga je werken Locatie: Veldhoven. Dit bedrijf is een voorloper in de high-tech machinebouw en richt zich op de ontwikkeling van geavanceerde technologieën voor de halfgeleiderindustrie. Gevestigd in Veldhoven, speelt deze organisatie een cruciale rol in het leveren van hardware, software en diensten aan chipfabrikanten over de hele wereld. Het bedrijf biedt een dynamische en innovatieve werkomgeving waar samenwerking en creativiteit centraal staan. Werknemers krijgen de kans om te werken aa…",2025-07-25T13:12:46Z,Software Engineer,hier ga je werken locatie veldhoven dit bedrijf is een voorloper in de hightech machinebouw en richt zich op de ontwikkeling van geavanceerde technologieën voor de halfgeleiderindustrie gevestigd in veldhoven speelt deze organisatie een cruciale rol in het leveren van hardware software en diensten aan chipfabrikanten over de hele wereld het bedrijf biedt een dynamische en innovatieve werkomgeving waar samenwerking en creativiteit centraal staan werknemers krijgen de kans om te werken
Internship: Optimization of the sequence generation and merging capability of service actions,ASML,"Veldhoven, Noord-Brabant",Are you a Bachelor or Master student in IT / Software Engineering with a strong affinity with technology? Then this internship could be interesting for you. Introduction Are you a Bachelor or Master student in IT / Software Engineering with a strong affinity with technology? Then this internship could be interesting for you. Job Mission As the Service Design & Engineering department of ASML we deliver structural embedded solutions to the field engineers and our customers. You can be a part off …,2023-12-18T12:35:49Z,Software Engineer,are you a bachelor or master student in it software engineering with a strong affinity with technology then this internship could be interesting for you introduction are you a bachelor or master student in it software engineering with a strong affinity with technology then this internship could be interesting for you job mission as the service design engineering department of asml we deliver structural embedded solutions to the field engineers and our customers you can be a part off
Internship: signal improvement of level sensor software simulator,ASML,"Veldhoven, Noord-Brabant",Are you a Bachelor student in Software Engineering with an interest in efficient signal simulation and generation? Then this graduation assignment could be interesting for you. Introduction Are you a Bachelor student in Software Engineering with an interest in efficient signal simulation and generation? Then this apprentice / graduation assignment could be interesting for you. Job Mission ASML is market leader in high-end exposure tools for the chip industry. A sub-function of this tool is the …,2024-02-13T13:02:07Z,Software Engineer,are you a bachelor student in software engineering with an interest in efficient signal simulation and generation then this graduation assignment could be interesting for you introduction are you a bachelor student in software engineering with an interest in efficient signal simulation and generation then this apprentice graduation assignment could be interesting for you job mission asml is market leader in highend exposure tools for the chip industry a subfunction of this tool is the
Senior Java Developer,Cross Border Talents,"Veldhoven, Noord-Brabant","Currently, Cross Border Talents are in search of a Senior Java Developer for one of our clients in the Netherlands. The company in question is a renowned Dutch agency specialized in the recruitment and relocation of technical specialists for the Netherlands. Some of the names they work with include clients like ASML, VDL, DAF Trucks, Siemens and many more. For one of their projects for an international innovation leader in the semiconductor industry, they are looking for a Java Developer. You’l…",2023-05-02T16:48:45Z,Software Engineer,currently cross border talents are in search of a senior java developer for one of our clients in the netherlands the company in question is a renowned dutch agency specialized in the recruitment and relocation of technical specialists for the netherlands some of the names they work with include clients like asml vdl daf trucks siemens and many more for one of their projects for an international innovation leader in the semiconductor industry they are looking for a java developer
Senior Embedded Software Designer,ASML,"Veldhoven, Noord-Brabant","ASML is leading in the worldwide development, production and sales of high-end lithography systems for the semiconductor industry. Worldwide over 10.000 people work at ASML, with i Introduction ASML is leading in the worldwide development, production and sales of high-end lithography systems for the semiconductor industry. Worldwide over 10.000 people work at ASML, with important settlings in the United States, Asia and the head office in Veldhoven. The employees of ASML share the passion for t…",2023-12-18T12:35:49Z,Software Engineer,asml is leading in the worldwide development production and sales of highend lithography systems for the semiconductor industry worldwide over people work at asml with i introduction asml is leading in the worldwide development production and sales of highend lithography systems for the semiconductor industry worldwide over people work at asml with important settlings in the united states asia and the head office in veldhoven the employees of asml share the passion for
DevOps Engineer,Cross Border Talents,"Veldhoven, Noord-Brabant","Currently, Cross Border Talents are in search of a DevOps Engineer for one of our clients in the Netherlands. The company in question is a renowned Dutch agency specialized in the recruitment and relocation of technical specialists for the Netherlands. Some of the names they work with include clients like ASML, VDL, DAF Trucks, Siemens and many more. For one of their projects for a company which is an international innovation leader in the semiconductor industry, they are looking for a DevOps E…",2023-04-09T18:13:14Z,Software Engineer,currently cross border talents are in search of a devops engineer for one of our clients in the netherlands the company in question is a renowned dutch agency specialized in the recruitment and relocation of technical specialists for the netherlands some of the names they work with include clients like asml vdl daf trucks siemens and many more for one of their projects for a company which is an international innovation leader in the semiconductor industry they are looking for a devops
